{
  "$schema": "./tokens.schema.json",
  "$description": "Maggi persona design system: single source of truth for Claude Design and Claude Code. Values follow the W3C Design Tokens (DTCG) shape ($value/$type/$description). Aliases use {dot.path} syntax. Edit this file only; per-persona files in personas/ are generated by tools/build-tokens.py.",
  "meta": {
    "system": "maggi-persona-design-system",
    "version": "0.1.0",
    "gate": 1,
    "status": "proposed",
    "statusNote": "Gate 1 proposal. Every value below is design judgement unless it carries a brief section reference. Nothing is locked until Gate 1 approval.",
    "brief": "brief/maggi-persona-project-brief-v2.md",
    "precedence": "Part II (Sections 16-28) overrides Part I on conflict.",
    "colourFormat": "6-digit sRGB hex. Contrast per WCAG 2.2; colour-vision simulation per Machado et al. 2009 (severity 1.0); colour difference = OKLab Euclidean distance x100.",
    "brandLockup": "Private design-gig project (decision 2026-10-07): real MAGGI logo and real Nestle MAGGI packaging may be used. Brand images stay in git-ignored brief/references/ and are never committed. No slogans invented as MAGGI's; no health claims (Section 22 still applies).",
    "fontLicence": "All proposed families are distributed on Google Fonts under the SIL Open Font License. Re-verify licence before commercial release."
  },
  "brand": {
    "$description": "Shared constants. Personas re-render these through their own constraint; they never redefine them (Section 6, 9).",
    "color": {
      "red": {
        "$type": "color",
        "$value": "#D42A1E",
        "$description": "Maggi-inspired red energy. Inspired, not sampled from real packaging."
      },
      "yellow": {"$type": "color", "$value": "#FFC20E", "$description": "Maggi-inspired yellow energy."},
      "ink": {"$type": "color", "$value": "#1C1410", "$description": "Warm near-black for shared system text."},
      "paper": {"$type": "color", "$value": "#FFF8EC", "$description": "Warm off-white shared surface."},
      "heritage-thread": {
        "$type": "string",
        "$value": "red-over-yellow",
        "$description": "Two-band rule, red above yellow, each band = 1 persona stroke width, 1:1 ratio. At most once per layout. Never a flag motif (Section 6)."
      }
    },
    "contrast": {
      "level": "AA",
      "pairs": [
        {"fg": "{brand.color.ink}", "bg": "{brand.color.paper}", "use": "body", "where": "system docs, overview strip"},
        {"fg": "{brand.color.red}", "bg": "{brand.color.paper}", "use": "body", "where": "red headings on paper"},
        {"fg": "{brand.color.paper}", "bg": "{brand.color.red}", "use": "body", "where": "reversed red band"},
        {"fg": "{brand.color.ink}", "bg": "{brand.color.yellow}", "use": "body", "where": "text on yellow band"}
      ],
      "distinguish": [
        {"a": "{brand.color.red}", "b": "{brand.color.yellow}", "why": "sachet halves and heritage thread"}
      ]
    },
    "space": {
      "$description": "4-point base spacing scale shared by every persona. Stack may only use the 8-multiples.",
      "unit": {"$type": "dimension", "$value": "4px"},
      "scale": {
        "$type": "dimension",
        "$value": ["0px", "4px", "8px", "12px", "16px", "24px", "32px", "48px", "64px", "96px", "128px"]
      }
    },
    "grid": {
      "columns": {"$type": "number", "$value": 12},
      "gutter": {"$type": "dimension", "$value": "24px"},
      "margin": {"$type": "dimension", "$value": "48px"},
      "baseline": {"$type": "dimension", "$value": "8px"}
    },
    "type": {
      "fallback": {
        "sans": {
          "$type": "fontFamily",
          "$value": ["system-ui", "-apple-system", "Segoe UI", "Roboto", "Noto Sans", "Arial", "sans-serif"]
        },
        "serif": {"$type": "fontFamily", "$value": ["Georgia", "Noto Serif", "Times New Roman", "serif"]},
        "mono": {"$type": "fontFamily", "$value": ["ui-monospace", "Consolas", "Menlo", "Noto Sans Mono", "monospace"]}
      },
      "base-size": {"$type": "dimension", "$value": "16px"},
      "min-size": {
        "$description": "Minimum type size per medium (Section 21). Packaging minimums must also meet local labelling law.",
        "web-body": {"$type": "dimension", "$value": "16px"},
        "web-caption": {"$type": "dimension", "$value": "14px"},
        "app-body": {"$type": "dimension", "$value": "16px"},
        "print-body": {"$type": "dimension", "$value": "9pt"},
        "print-caption": {"$type": "dimension", "$value": "7pt"},
        "packaging-copy": {"$type": "dimension", "$value": "7pt"},
        "motion-1080p": {"$type": "dimension", "$value": "48px"},
        "sticker-512": {"$type": "dimension", "$value": "48px"}
      },
      "line-height": {
        "$description": "Defaults; personas override. Text line-height >= 1.5 satisfies WCAG 1.4.12.",
        "display": {"$type": "number", "$value": 1.1},
        "text": {"$type": "number", "$value": 1.5}
      }
    },
    "touch-target": {"$type": "dimension", "$value": "44px", "$description": "WCAG 2.5.5 target size. Nest raises this to 56px."},
    "scale-tests": {
      "$type": "dimension",
      "$value": ["16px", "32px", "64px", "512px"],
      "$description": "Section 18.15 mandatory render sizes."
    },
    "sachet": {
      "$description": "Shared prop (Section 18.3). Constant geometry in every world, in rig units on the 1024 canvas. Colour comes from each persona's role.sachet-red / role.sachet-yellow.",
      "width": {"$type": "dimension", "$value": "160px", "$description": "rig units"},
      "height": {"$type": "dimension", "$value": "240px", "$description": "rig units; aspect 1.5"},
      "corner-radius": {"$type": "dimension", "$value": "8px", "$description": "rig units"},
      "crimp": {"$type": "string", "$value": "12-unit band at top and bottom edges, serrated with 8-unit teeth"},
      "split": {
        "$type": "string",
        "$value": "Straight line from the left edge at 70% height to the right edge at 30% height. Upper-left region = sachet-red, lower-right = sachet-yellow."
      },
      "tear-notch": {
        "$type": "string",
        "$value": "Isosceles triangle, 16 units wide, 12 deep, cut into the right edge 24 units below the top crimp"
      },
      "mark": {
        "$type": "string",
        "$value": "Persona '2' glyph centred on the yellow region, glyph height = 40% of sachet width"
      }
    },
    "two-mark": {
      "$description": "The shared '2' convenience mark. Each persona draws its own glyph (Section 18.6) inside this construction box.",
      "box": {"$type": "string", "$value": "width:height = 1:1.25, baseline at box bottom, cap height = 80% of box height"},
      "min-stroke": {
        "$type": "number",
        "$value": 0.125,
        "$description": "Minimum stroke as a fraction of glyph height (= 2px at 16px)."
      },
      "min-counter": {
        "$type": "number",
        "$value": 0.25,
        "$description": "Minimum open counter (the bowl of the 2) as a fraction of glyph width."
      },
      "min-legible": {"$type": "dimension", "$value": "16px", "$description": "Every persona '2' must read as a 2 at 16px."},
      "meaning": {
        "$type": "string",
        "$value": "Felt time, not a cook-time claim (Section 18.2). Any copy stating actual vs felt cook time needs Nestle review."
      }
    },
    "steam-curl": {
      "$description": "Constant across all seven worlds (Section 18.1). Sizes relative to the vessel rim width W.",
      "wisps": {"$type": "number", "$value": 3},
      "heights": {"$type": "string", "$value": "left 0.45W, middle 0.60W, right 0.40W"},
      "spacing": {"$type": "string", "$value": "0.18W between wisp bases, group centred on the rim"},
      "shape": {"$type": "string", "$value": "S-curve with exactly 2 inflections, rising vertically, tips taper to 0"},
      "stroke": {"$type": "string", "$value": "persona shape.stroke with round caps (Lull: filled shapes, no stroke)"}
    },
    "layout": {
      "lockup-slot": {
        "$description": "Reserved for the brand team; left empty in all work (Section 22).",
        "position": {"$type": "string", "$value": "top-left, inside the grid margin"},
        "width": {"$type": "string", "$value": "3 of 12 grid columns"},
        "height": {"$type": "string", "$value": "0.5 x slot width"},
        "clear-space": {"$type": "string", "$value": "0.25 x slot height on all four sides"}
      }
    },
    "noodle-thread": {
      "$description": "Continuous overview connector (Section 18.4).",
      "entry-height": {
        "$type": "number",
        "$value": 0.62,
        "$description": "Fraction of panel height from the top, identical at left and right edges of every panel, so panels reorder freely."
      },
      "stroke": {"$type": "number", "$value": 0.00625, "$description": "Fraction of panel height (12px at 1920px)."},
      "entry-angle": {
        "$type": "number",
        "$value": 0,
        "$description": "Degrees. The thread is horizontal for the first and last 4% of panel width."
      }
    },
    "border-width": {
      "hairline": {"$type": "dimension", "$value": "1px"},
      "ui": {"$type": "dimension", "$value": "2px"},
      "focus": {"$type": "dimension", "$value": "3px"}
    },
    "focus": {
      "$description": "WCAG 2.4.7 / 2.4.11. Every persona role.focus must reach 3:1 against role.bg and role.surface.",
      "width": {"$type": "dimension", "$value": "{brand.border-width.focus}"},
      "offset": {"$type": "dimension", "$value": "2px"},
      "style": {"$type": "string", "$value": "solid outline following the element radius"}
    },
    "breakpoint": {
      "$description": "For web/ (Gate 5).",
      "mobile-max": {"$type": "dimension", "$value": "599px"},
      "tablet-min": {"$type": "dimension", "$value": "600px"},
      "desktop-min": {"$type": "dimension", "$value": "1024px"}
    },
    "density": {